{
  "request": {
    "additional_read_paths": [],
    "batch_id": "genesis-001",
    "claimed_input_paths": [],
    "operation_id": "genesis",
    "operation_type": "generic",
    "payloads": [
      {
        "content_file": "publication-input/content/44136fa355b3678a1146ad16f7e8649e94fb4fc21fe77e8310c060f61caaff8a",
        "path": "wiki/meta/records/genesis.json",
        "sha256": "44136fa355b3678a1146ad16f7e8649e94fb4fc21fe77e8310c060f61caaff8a",
        "size_bytes": 2
      }
    ],
    "prospective_groups": [],
    "schema": "video-paper-wiki.knowledge-publication-request.v1"
  },
  "request_sha256": "ce62c7c150486943f3ad34f023738b759295dcc20a43640244a3aeb9c16b3eb8",
  "schema": "video-paper-wiki.publication-authority.v1",
  "transaction": {
    "address_requests": [],
    "claimed_inputs": [],
    "declaration_sha256": "8dd7675e7ab4b835d3e642720865a7a459e51c0e5d76a9ba191a97a6d3843c83",
    "engine_expanded_paths": [],
    "expected_hashes": {
      "wiki/meta/operations/000000000001-genesis.json": null,
      "wiki/meta/records/genesis.json": null,
      "wiki/meta/registries/operation-head.json": null
    },
    "head": {
      "receipt_path": "wiki/meta/operations/000000000001-genesis.json",
      "receipt_sha256": "d75619884909d3f4f051fc8243caa2a85bad73f741cd5c96e575613977fbbbc8",
      "schema": "video-paper-wiki.operation-head.v1",
      "sequence": 1
    },
    "input_bundle_sha256": "2c58ffea82875d290b3796b981bc54d99b720fb3af1285085d2a6816734837fb",
    "inspection": {
      "approval_sha256": "01ba990f05c45a6198576cbbf20f058208f6dfc2158aa0bec802114dc5471ea1",
      "changed_paths": [
        "wiki/meta/records/genesis.json",
        "wiki/meta/operations/000000000001-genesis.json",
        "wiki/meta/registries/operation-head.json"
      ],
      "expanded_bundle_sha256": "2c58ffea82875d290b3796b981bc54d99b720fb3af1285085d2a6816734837fb",
      "hashes": {
        "wiki/meta/operations/000000000001-genesis.json": "d75619884909d3f4f051fc8243caa2a85bad73f741cd5c96e575613977fbbbc8",
        "wiki/meta/records/genesis.json": "44136fa355b3678a1146ad16f7e8649e94fb4fc21fe77e8310c060f61caaff8a",
        "wiki/meta/registries/operation-head.json": "26a422710a0c3c8d2300c55e27f162dfa296de1de4988b8182c20f9c1831ae19"
      },
      "input_bundle_sha256": "2c58ffea82875d290b3796b981bc54d99b720fb3af1285085d2a6816734837fb",
      "modes": {
        "wiki/meta/operations/000000000001-genesis.json": 384,
        "wiki/meta/records/genesis.json": 384,
        "wiki/meta/registries/operation-head.json": 384
      },
      "operation_id": "genesis",
      "operation_type": "generic",
      "schema": "claude-obsidian.transaction-plan.v1",
      "valid": true,
      "vault_identity": {
        "device": 16777233,
        "inode": 4434583,
        "state": "existing"
      }
    },
    "operation_id": "genesis",
    "operation_type": "generic",
    "phase": "inspected",
    "read_preconditions": {},
    "receipt": {
      "claimed_inputs": [],
      "intent_sha256": "4b6b764ab18ce33933cc8a8827d3a7b882cadfff05cb171af31a4250961b7f96",
      "operation_id": "genesis",
      "operation_type": "generic",
      "previous": null,
      "schema": "video-paper-wiki.operation-receipt.v1",
      "sequence": 1,
      "writes": [
        {
          "after_sha256": "44136fa355b3678a1146ad16f7e8649e94fb4fc21fe77e8310c060f61caaff8a",
          "before_sha256": null,
          "mode": "create",
          "path": "wiki/meta/records/genesis.json"
        }
      ]
    },
    "runtime_result": null,
    "schema": "video-paper-wiki.transaction-facade.v1",
    "source_manifest_updates": {},
    "writes": [
      {
        "mode": "create",
        "original_mode": null,
        "original_size_bytes": 0,
        "path": "wiki/meta/records/genesis.json",
        "role": "business",
        "sha256": "44136fa355b3678a1146ad16f7e8649e94fb4fc21fe77e8310c060f61caaff8a",
        "size_bytes": 2
      },
      {
        "mode": "create",
        "original_mode": null,
        "original_size_bytes": 0,
        "path": "wiki/meta/operations/000000000001-genesis.json",
        "role": "receipt",
        "sha256": "d75619884909d3f4f051fc8243caa2a85bad73f741cd5c96e575613977fbbbc8",
        "size_bytes": 406
      },
      {
        "mode": "create",
        "original_mode": null,
        "original_size_bytes": 0,
        "path": "wiki/meta/registries/operation-head.json",
        "role": "head",
        "sha256": "26a422710a0c3c8d2300c55e27f162dfa296de1de4988b8182c20f9c1831ae19",
        "size_bytes": 208
      }
    ]
  },
  "transaction_staging": {
    "already_staged": false,
    "batch_id": "genesis-001",
    "bundle_file": "transaction-inspect/bundle.json",
    "bundle_sha256": "2c58ffea82875d290b3796b981bc54d99b720fb3af1285085d2a6816734837fb",
    "bundle_size_bytes": 1039,
    "content_files": [
      {
        "content_file": "transaction-inspect/content/26a422710a0c3c8d2300c55e27f162dfa296de1de4988b8182c20f9c1831ae19",
        "sha256": "26a422710a0c3c8d2300c55e27f162dfa296de1de4988b8182c20f9c1831ae19",
        "size_bytes": 208
      },
      {
        "content_file": "transaction-inspect/content/44136fa355b3678a1146ad16f7e8649e94fb4fc21fe77e8310c060f61caaff8a",
        "sha256": "44136fa355b3678a1146ad16f7e8649e94fb4fc21fe77e8310c060f61caaff8a",
        "size_bytes": 2
      },
      {
        "content_file": "transaction-inspect/content/d75619884909d3f4f051fc8243caa2a85bad73f741cd5c96e575613977fbbbc8",
        "sha256": "d75619884909d3f4f051fc8243caa2a85bad73f741cd5c96e575613977fbbbc8",
        "size_bytes": 406
      }
    ],
    "operation_id": "genesis",
    "operation_type": "generic",
    "schema": "video-paper-wiki.transaction-staging.v1",
    "transaction_declaration_sha256": "8dd7675e7ab4b835d3e642720865a7a459e51c0e5d76a9ba191a97a6d3843c83"
  },
  "upstream_authority": {
    "profile": "claude-obsidian-transaction-inspect-9f8c119-v1",
    "schema": "video-paper-wiki.upstream-authority.v1",
    "transaction": {
      "address_requests": [],
      "claimed_inputs": [],
      "declaration_sha256": "8dd7675e7ab4b835d3e642720865a7a459e51c0e5d76a9ba191a97a6d3843c83",
      "engine_expanded_paths": [],
      "expected_hashes": {
        "wiki/meta/operations/000000000001-genesis.json": null,
        "wiki/meta/records/genesis.json": null,
        "wiki/meta/registries/operation-head.json": null
      },
      "head": {
        "receipt_path": "wiki/meta/operations/000000000001-genesis.json",
        "receipt_sha256": "d75619884909d3f4f051fc8243caa2a85bad73f741cd5c96e575613977fbbbc8",
        "schema": "video-paper-wiki.operation-head.v1",
        "sequence": 1
      },
      "input_bundle_sha256": "2c58ffea82875d290b3796b981bc54d99b720fb3af1285085d2a6816734837fb",
      "inspection": {
        "approval_sha256": "01ba990f05c45a6198576cbbf20f058208f6dfc2158aa0bec802114dc5471ea1",
        "changed_paths": [
          "wiki/meta/records/genesis.json",
          "wiki/meta/operations/000000000001-genesis.json",
          "wiki/meta/registries/operation-head.json"
        ],
        "expanded_bundle_sha256": "2c58ffea82875d290b3796b981bc54d99b720fb3af1285085d2a6816734837fb",
        "hashes": {
          "wiki/meta/operations/000000000001-genesis.json": "d75619884909d3f4f051fc8243caa2a85bad73f741cd5c96e575613977fbbbc8",
          "wiki/meta/records/genesis.json": "44136fa355b3678a1146ad16f7e8649e94fb4fc21fe77e8310c060f61caaff8a",
          "wiki/meta/registries/operation-head.json": "26a422710a0c3c8d2300c55e27f162dfa296de1de4988b8182c20f9c1831ae19"
        },
        "input_bundle_sha256": "2c58ffea82875d290b3796b981bc54d99b720fb3af1285085d2a6816734837fb",
        "modes": {
          "wiki/meta/operations/000000000001-genesis.json": 384,
          "wiki/meta/records/genesis.json": 384,
          "wiki/meta/registries/operation-head.json": 384
        },
        "operation_id": "genesis",
        "operation_type": "generic",
        "schema": "claude-obsidian.transaction-plan.v1",
        "valid": true,
        "vault_identity": {
          "device": 16777233,
          "inode": 4434583,
          "state": "existing"
        }
      },
      "operation_id": "genesis",
      "operation_type": "generic",
      "phase": "inspected",
      "read_preconditions": {},
      "receipt": {
        "claimed_inputs": [],
        "intent_sha256": "4b6b764ab18ce33933cc8a8827d3a7b882cadfff05cb171af31a4250961b7f96",
        "operation_id": "genesis",
        "operation_type": "generic",
        "previous": null,
        "schema": "video-paper-wiki.operation-receipt.v1",
        "sequence": 1,
        "writes": [
          {
            "after_sha256": "44136fa355b3678a1146ad16f7e8649e94fb4fc21fe77e8310c060f61caaff8a",
            "before_sha256": null,
            "mode": "create",
            "path": "wiki/meta/records/genesis.json"
          }
        ]
      },
      "runtime_result": null,
      "schema": "video-paper-wiki.transaction-facade.v1",
      "source_manifest_updates": {},
      "writes": [
        {
          "mode": "create",
          "original_mode": null,
          "original_size_bytes": 0,
          "path": "wiki/meta/records/genesis.json",
          "role": "business",
          "sha256": "44136fa355b3678a1146ad16f7e8649e94fb4fc21fe77e8310c060f61caaff8a",
          "size_bytes": 2
        },
        {
          "mode": "create",
          "original_mode": null,
          "original_size_bytes": 0,
          "path": "wiki/meta/operations/000000000001-genesis.json",
          "role": "receipt",
          "sha256": "d75619884909d3f4f051fc8243caa2a85bad73f741cd5c96e575613977fbbbc8",
          "size_bytes": 406
        },
        {
          "mode": "create",
          "original_mode": null,
          "original_size_bytes": 0,
          "path": "wiki/meta/registries/operation-head.json",
          "role": "head",
          "sha256": "26a422710a0c3c8d2300c55e27f162dfa296de1de4988b8182c20f9c1831ae19",
          "size_bytes": 208
        }